{
  "caption": "Finding Information",
  "description": "The Finding Information object describes metadata related to a security finding generated by a security tool or system.",
  "extends": "object",
  "name": "finding_info",
  "attributes": {
    "analytic": {
      "requirement": "recommended"
    },
    "attacks":{
      "description": "The <a target='_blank' href='https://attack.mitre.org'>MITRE ATT&CK®</a> technique and associated tactics related to the finding.",
      "requirement": "optional"
    },
    "created_time": {
      "description": "The time when the finding was created.",
      "requirement": "optional"
    },
    "data_sources": {
      "requirement": "optional"
    },
    "desc": {
      "description": "The description of the reported finding.",
      "requirement": "optional"
    },
    "first_seen_time": {
      "description": "The time when the finding was first observed. e.g. The time when a vulnerability was first observed. <p>It can differ from the <code>created_time</code> timestamp, which reflects the time this finding was created.</p>",
      "requirement": "optional"
    },
    "kill_chain": {
      "requirement": "optional"
    },
    "last_seen_time": {
      "description": "The time when the finding was most recently observed. e.g. The time when a vulnerability was most recently observed. <p>It can differ from the <code>modified_time</code> timestamp, which reflects the time this finding was last modified.</p>",
      "requirement": "optional"
    },
    "modified_time": {
      "description": "The time when the finding was last modified.",
      "requirement": "optional"
    },
    "product_uid": {
      "description": "The unique identifier of the product that reported the finding.",
      "requirement": "optional"
    },
    "related_events": {
      "requirement": "optional"
    },
    "related_analytics": {
      "description": "Other analytics related to this finding.",
      "requirement": "optional"
    },
    "src_url": {
      "description": "The URL pointing to the source of the finding.",
      "requirement": "optional"
    },
    "title": {
      "description": "A title or a brief phrase summarizing the reported finding.",
      "requirement": "required"
    },
    "types": {
      "description": "One or more types of the reported finding.",
      "requirement": "optional"
    },
    "uid": {
      "description": "The unique identifier of the reported finding.",
      "requirement": "required"
    },
    "vendor_attributes":{
      "requirement": "optional"
    }
  }
}
