{
  "caption": "Date/Time",
  "description": "When applied, this profile adds a sibling attribute of data type <code>datetime_t</code> (RFC-3339 string) wherever a <code>timestamp_t</code> attribute appears in the event class. This provides human-readable date/time representations alongside the epoch-millisecond timestamps. For example, <code>time</code> (<code>timestamp_t</code>) would gain a <code>time_dt</code> (<code>datetime_t</code>) sibling such as <code>\"1985-04-12T23:20:50.52Z\"</code>. See <a target='_blank' href='https://www.rfc-editor.org/rfc/rfc3339.html'>RFC-3339</a>.",
  "meta": "profile",
  "name": "datetime",
  "attributes": {}
}
