{
  "caption": "Additional Restriction",
  "description": "Defines additional restrictions and their applicability status.",
  "extends": "object",
  "name": "additional_restriction",
  "attributes": {
    "policy": {
      "description": "Specifies the details of the policy that define this additional restriction.",
      "requirement": "required"
    },
    "status": {
      "description": "The normalized status of the additional restriction, normalized to the caption of the <code>status_id</code> enum value.",
      "requirement": "optional"
    },
    "status_id": {
      "description": "The normalized status identifier of the additional restriction indicating whether this restriction is applicable",
      "requirement": "recommended",
      "enum": {
        "1": {
          "caption": "Applicable",
          "description": "This restriction is applicable"
        },
        "2": {
          "caption": "Not Applicable",
          "description": "This restriction is not applicable"
        },
        "3": {
          "caption": "Evaluation Failure",
          "description": "This restriction could not be evaluated"
        }
      }
    }
  }
}