{
  "caption": "HTTP Response",
  "description": "The HTTP Response object contains detailed information about the response sent from a web server to the requester. It encompasses attributes and metadata that describe the response status, headers, body content, and other relevant information.",
  "extends": "object",
  "name": "http_response",
  "attributes": {
    "body_length": {
      "caption": "Response Body Length",
      "description": "The actual length of the HTTP response body, in number of bytes, independent of a potentially existing Content-Length header.",
      "requirement": "optional"
    },
    "code": {
      "description": "The Hypertext Transfer Protocol (HTTP) status code returned from the web server to the client. For example, 200.",
      "requirement": "required"
    },
    "content_type": {
      "requirement": "optional"
    },
    "http_headers": {
      "requirement": "recommended"
    },
    "latency": {
      "requirement": "optional"
    },
    "length": {
      "caption": "Response Length",
      "description": "The length of the entire HTTP response, in number of bytes.",
      "requirement": "optional"
    },
    "message": {
      "description": "The HTTP response message, such as the reason phrase associated with the status code (e.g., <code>\"OK\"</code>, <code>\"Not Found\"</code>).",
      "requirement": "optional"
    },
    "status": {
      "description": "The response status. For example: A successful HTTP status of 'OK' which corresponds to a code of 200.",
      "requirement": "optional"
    }
  },
  "references": [
    {
      "description": "D3FEND™ Ontology d3f:InboundInternetNetworkTraffic.",
      "url": "https://d3fend.mitre.org/dao/artifact/d3f:InboundInternetNetworkTraffic/"
    }
  ]
}