{
  "caption": "Firewall Rule",
  "description": "The Firewall Rule object represents a specific rule within a firewall policy or event. It contains information about a rule's configuration, properties, and associated actions that define how network traffic is handled by the firewall.",
  "name": "firewall_rule",
  "extends": "rule",
  "attributes": {
    "condition": {
      "description": "The rule trigger condition for the rule. For example: SQL_INJECTION.",
      "requirement": "optional"
    },
    "sensitivity": {
      "requirement": "optional"
    },	
    "match_location": {
      "requirement": "optional"
    },	
    "match_details": {
      "requirement": "optional"
    },	
    "rate_limit": {
      "requirement": "optional"
    },
    "duration": {
      "description": "The rule response time duration, usually used for challenge completion time.",
      "requirement": "optional"
    }
  }
}
