{
  "caption": "Policy Analysis",
  "description": "",
  "extends": "object",
  "name": "policy_analysis",
  "attributes": {
    "condition": {
      "description": "The condition that was evaluated in the policy.",
      "requirement": "optional"
    },
    "granted_actions": {
      "description": "The actions that were granted by the policy.",
      "requirement": "optional"
    },
    "policy": {
      "description": "Details about the policy that triggered the finding.",
      "requirement": "recommended"
    },
    "unused_actions_num": {
      "description": "The number of unused actions in the policy.",
      "requirement": "optional"
    },
    "unused_services_num": {
      "description": "The number of unused services in the policy.",
      "requirement": "optional"
    }
  }
}