{
  "caption": "Response Elements",
  "description": "The Response Elements object describes characteristics of an API response.",
  "extends": "object",
  "name": "response",
  "attributes": {
    "code": {
      "requirement": "recommended"
    },
    "containers": {
      "requirement": "optional"
    },
    "data": {
      "description": "The additional data that is associated with the api response.",
      "requirement": "optional"
    },
    "error": {
      "requirement": "recommended"
    },
    "error_message": {
      "requirement": "recommended"
    },
    "flags": {
      "description": "The communication flags that are associated with the api response.",
      "requirement": "optional"
    },
    "message": {
      "description": "The response message provided by the service or API.",
      "requirement": "recommended"
    }
  }
}