{
  "caption": "Identity Analysis",
  "description": "The identity analysis object describes details about the analysis performed on an Identity i.e. AWS IAM User, GCP IAM Principal, etc.",
  "extends": "object",
  "name": "identity_analysis",
  "attributes": {
    "credential_last_used_time": {
      "description": "Timestamp when the credential, represented by the <code>credential_uid</code>, was last used.",
      "requirement": "optional"
    },
    "credential_uid": {
      "requirement": "optional"
    },
    "password_last_used_time": {
      "description": "Timestamp when the password was last used for authentication.",
      "requirement": "optional"
    },
    "user_last_used_time": {
      "description": "Timestamp when the user account was last active.",
      "requirement": "optional"
    }
  }
}
